{
  "args": [],
  "determinism_pins": {
    "ftz_daz": false,
    "locale": "C",
    "network_mode": "deny",
    "rounding": "nearest",
    "thread_mode": "single",
    "timezone": "UTC"
  },
  "platform": "mac",
  "resolution": "1280x720",
  "schema_version": "1.0.0",
  "seed": 12345,
  "shard": 1,
  "test_api_fingerprint": "fnv64:fc3a593cce0e3168",
  "timeout_seconds": 180,
  "timestamp": "2026-02-06T14:05:10Z",
  "total_shards": 1
}