{
  "args": [],
  "determinism_pins": {
    "ftz_daz": true,
    "locale": "C",
    "network_mode": "deny",
    "rounding": "nearest",
    "thread_mode": "single",
    "timezone": "UTC"
  },
  "platform": "linux",
  "resolution": "1280x720",
  "schema_version": "1.0.0",
  "seed": 12345,
  "shard": 1,
  "test_api_fingerprint": "fnv64:1a635d2c76372b83",
  "timeout_seconds": 600,
  "timestamp": "2026-02-04T01:52:57Z",
  "total_shards": 1
}